category_id,post_name,option A,option B,option C,option D,correct option,explanation
9,कुन जातीको विवाहमा दुलाहाको साथमा कालो छाता अनिवार्य मानिन्छ ? ,गन्गाई,राई ,गुरूङ,तामाङ,b,
9,मुसहरको कुल देवतालाई के भनिन्छ ? ,गणेश,भिमसेन ,दिनाभद्री ,देउवागण,c,
9,तेरिमिन कुन जातिको चाड हो ? ,मेचे,गुरूङ,मारवाडी ,मार्फाली ,d,
9,बच्चा जन्मिएपछि अनुहार हेर्दा एक रुपैयाँ र एक ईंटा दिने चलन कुन जातिमा रहेको छ ? ,धिमाल ,मारवाडी ,गन्गाई,राजवंशी ,b,
9,चण्डी पूजा कुन जातीको पर्व हो ? ,राई ,गुरूङ,तामाङ,लिम्बु,a,
9,मेचे जातिहरूको बसोबास कहाँ  रहेको छ  ? ,दाङ,झापा ,सुनसरी ,बर्दिया,b,
20,मुस्लिम महिलाहरूले शीरदेखि पाउसम्म छोपिने गरी लगाउने कालो कपडालाई के भनिन्छ ? ,गाउन,बुर्का ,पालाहन्दा ,लवेदा,b,
9,मुगाली जातिको बसोबास कहाँ रहेको छ ? ,बाँके ,दाङ,मुगु ,सुनसरी ,c,
9,गणगौर पूजा कुन जातिसँग सम्बन्धित छ ? ,मारवाडी ,राजवंशी ,चेपाङ,मुसहर,a,
9,माझीहरूको कुल देवतालाई के भनिन्छ ? ,कुमार,दिनाभद्री ,वायु,भिमसेन ,d,
20,हंगेरीका आदिवासी मग्यारबिच नजिकको सम्बन्ध रहेको मानिने नेपालको जाति कुन हो ? ,लिम्बु,राजवंशी ,मगर,तामाङ,c,
9,भोटे जातीहरू बसोबास गरेको क्षेत्रलाई के भनिन्छ ? ,डिहिवार,जडान ,भोट,लेक,b,
9,केटी भगाएपछि केटीको बाबु आमासँग माफी माग्ने चलन कुन जातिमा रहेको छ ? ,चेपाङ,माझी ,बाह्र गाउँले ,राई,c,
9,कुल देवताको रुपमा वायु देवताको पूजा गर्ने जाति कुन हो ? ,शेर्पा,बराम ,राजवंशी ,पुनेल ,b,
9,केटीको अपहरण गरेर विवाह गर्ने चलन कुन जातिमा रहेको छ ? ,राजवंशी ,तामाङ,बाह्र गाउँले ,पुनेल ,d,
9,भटमास र अदुवालाई पवित्र मान्ने जाति कुन हो ? ,नेवार,मारवाडी ,पहरी ,राजवंशी ,c,
9,नेवार जातिले गोसाईं कुण्डलाई के भन्दछन् ? ,सपन तिर्थ,शिलुतिर्थ ,मातातिर्थ,बिष्णुमति,b,
9,नेवार भाषाको लिपिलाई के भनिन्छ ? ,देवनागरी ,मलयालम लिपि,रन्जना लिपी ,सम्भोट लिपि,c,
9,नेवार महिलाहरूले टाउकोमा लगाउने सुनको गहनालाई के भनिन्छ ? ,ताज,बुलिन ,सिरबन्दी,चन्द्रमा,b,
9,विवाहमा दुलहा अन्माउनु भन्दा अघि गधाको पूजा गर्ने चलन कुन जातिमा रहेको छ ? ,पहरी ,बराम ,मार्फाली ,मारवाडी ,d,
9,माझी जातीको सबैभन्दा ठूलो देवता को हुन् ? ,भिमसेन,गैडु,महादेव,सेतीदेवी,a,
9,नेपालको आदिवासी चरित्रको सबै भन्दा पुरानो जाति कसलाई मानिन्छ ? ,थारू,मधेसी,मगर,राउटे ,d,
9,मेचे जातीहरूको बसोबास कुन जिल्लामा रहेको छ ? ,झापा,बाँके ,सुनसरी,बर्दिया,a,
9,मुण्डा जातीको बसोबास कहाँ रहेको छ ? ,सप्तरी,सुनसरी,झापा,मोरङ,c,
9,मार्फाली जातिको बसोबास कहाँ रहेको छ ? ,पर्वत,मुस्ताङ,जुम्ला ,हुम्ला,b,
9,मृतकको चिहान माथि मृतकको खटिया उत्तानो पारेर राख्ने चलन कुन जातीमा छ ? ,मेचे,माझी ,राजवंशी ,बाह्र गाउँले ,b,
9,मगरको पुरोहितलाई के भनिन्छ ? ,पण्डित,धन्नम,भुसाल ,देउवागण,c,
9,मगरहरूको बसोबास भएको क्षेत्रलाई के भनिन्छ ? ,लिम्बुवान,थरूहट,मधेस,मगरात,d,
9,बराम जातीले बोल्ने भाषालाई के भनिन्छ ? ,बर्मेली,बराम ,नेवारी,हिन्दी,b,
9,सुपारी विवाहको चलन कुन जातीमा रहेको छ ? ,गुरूङ,धिमाल,पहरी ,राजवंशी ,b,
9,विवाह पूर्व केटाकेटीको उचाई लौराले नापी बराबर भएमा विवाहको लागी सर्वोत्तम ठान्ने जाती कुन हो ? ,छन्थाल,चेपाङ,धानुक ,माझी ,c,
9,धानको खेती गर्न रुचाउने जाती भनेर कुन जातीलाई चिनिन्छ ? ,धानुक,धिमाल,पहरी ,राजवंशी ,a,
9,पाठीको बलि दिएर भंगेर पूजा गर्ने जाती कुन हो ? ,मगर,दराई ,दुरा ,थारू,c,
9,नयाँ वर्षको दिन पुरानो आगो निभाई नयाँ आगो बाल्ने चलन कुन जातीमा रहेको छ ? ,धानुक,दराई ,बाह्र गाउँले ,मेचे,b,
9,चुड्का कुन जातीको लोकप्रिय गीत हो ? ,दराई ,थारू,पहरी ,बराम ,a,
9,धानुक जातिको बसोबास कहाँ रहेको छ ? ,हिमाली क्षेत्र ,पहाडी क्षेत्र,तराई क्षेत्रमा ,उच्च हिमाली क्षेत्र,c,
9,दाङ जिल्लामा बसोबास गर्ने थारूलाई के भनिन्छ ? ,डगौरा थारू,राना थारू,कोठोरिया थारू,कोचिला थारू,a,
9,सहलेस नाच कुन जातीसँग सम्बन्धीत छ ? ,मुसहर,धिमाल,सतार,दनुवार ,d,
9,महर्वा नृत्य कुन जातीसँग सम्बन्धित छ ? ,मधेसी ,थारू,राजवंशी ,सुनार,b,
9,दनुवार जातीको इस्टदेवतालाई के भनिन्छ ? ,महादेव,दिनाभद्री ,सहलेस ,वायु,c,
9,तोरनल्ह पर्व कुन महिनामा मनाइन्छ ? ,वैशाख,फागुन ,माघ,चैत,b,
9,सरस्वती नाच कुन जातीसँग सम्बन्धीत छ ? ,लिम्बु,तामाङ,राई,गुरूङ,b,
9,मृत्यु संस्कार गर्दा १०८ बत्ती बाल्ने चलन कुन जातीमा छ ? ,मगर ,शेर्पा,लामा,तामाङ,d,
9,ताप्केगोला जातीको बसोबास कहाँ रहेको छ ? ,लमजुङ्,ताप्लेजुङ,पाँचथर,झापा,b,
9,तामाङ जातीले मृत्यु संस्कारमा घेवा गर्दा १०८ बत्ती बाल्ने कार्यलाई के भनिन्छ ? ,घेवा,ढिकुर,ग्याम्जा ,,c,
9,ताङ्वे जातीको बसोबास कहाँ रहेको छ ? ,मनाङ,गुल्मी,कालिकोट,मुस्ताङ,d,
9,मरेको लासलाई काटेर गिद्धलाई खुवाउने चलन कुन जातिमा रहेको छ ? ,ल्होमी,डोल्पो,लेप्चा ,ल्होपा ,b,
9,घन्टी बजाउँदा उत्तानो परेर बजाउने जाती कुन हो ? ,लामा,तामाङ,डोल्पो ,थामी ,c,
9,विवाहमा सिन्दुर साटासाट गर्ने चलन कुन जातीमा रहेको छ ? ,माझी,झाँगड,दनुवार ,मेचे,b,
9,प्रजा जाती भन्नाले कुन जातीलाई चिनिन्छ ? ,तामाङ,मेचे,चेपाङ,मगर ,c,
9,झाँगड जातीमा झगडा मिलाउने व्यक्तिलाई के भनिन्छ ? ,लमी,भाईज्यान ,मुखिया,जिवा,b,
9,गुरूङहरूको मुख्य मान्छेलाई के भनिन्छ ? ,चिवा ,जिवा,बाजे,नाइके,a,
9,पुटपुटे नाच कुन जातीसँग छ ? ,तामाङ,शेर्पा,मगर ,गुरूङ,d,
33,गुरूङ भाषामा बनेको पहिलो टेलिचलचित्र कुन हो ? ,ङोलो ङोल्स्यो,आप्पा,पाते ,तखेवा ,c,
33,लिम्बु भाषाको प्रथम टेलिचलचित्र कुन हो ? ,पाते ,नुमाफुङ,तखेवा ,म्थिेबा,c,
9,सुत्केरी भएको तेस्रो दिनमा जाँडरक्सी खुवाएर सुत्केरी चोख्याउने चलन कुन जातीमा रहेको छ ? ,ल्होमी,लेप्चा ,कोचे,सतार,b,
9,अस्ताच्यो र नामथर कुन जातीको धर्मग्रन्थ हो ? ,चेपाङ,ल्होमी ,लेप्चा ,झाँगड,c,
9,टुङ्ना कुन जातीको परम्परागत बाजा हो ? ,ल्होमी ,लिम्बु,लेप्चा ,ल्होपा ,d,
9,कारभोटे भनेर चिनिने जाति कुन हो ? ,ल्होपा ,सतार,ल्होमी ,दमाई,c,
9,बच्चा जन्मिसकेपछि मात्रै केटीको वैवाहिक विधि पूरा भएको मान्ने चलन कुन जातिमा रहेको छ ? ,लेप्चा ,ल्होमी ,राई,दनुवार ,b,
9,चण्डी पूजा कुन जातीको पर्व हो ? ,गुरूङ,तामाङ,राई,मगर ,c,
9,सिउडीको बोटलाई कुल देवताको रुपमा पूजा गर्ने जाति कुन हो ? ,मेचे ,दनुवार ,कोचे,सतार,a,
9,माझीहरूको कुल देवतालाई के भनिन्छ ? ,ईन्द्र,सेतीदेवी,सहलेस,भीमसेन ,d,
9,मगरहरूको बसोबास रहेको क्षेत्रलाई के भनिन्छ ? ,डिहिवार ,बेसी,मगरात,जडान,c,
9,बाँतर जातिहरू बसोबास गर्ने क्षेत्रलाई के भनिन्छ ? ,मगरात,डिहिवार ,बाँतर बस्ती,जडान,b,
9,बाह्र गाउँले जातिको बसोबास कहाँ रहेको छ ? ,मनाङ,झापा,मुस्ताङ,मोरङ,c,
9,पहरी जातिको बसोबास कुन जिल्लामा रहेको छ ? ,सिन्धुपाल्चोक ,चितवन ,मकवानपुर,काभ्रेपलान्चोक ,d,
9,मधेसका लिम्बु अथवा मधेसका किराँत भनेर चिनिने जाती कुन हो ? ,धिताल,धिमाल  ,राजवंशी ,धानुक,b,
9,सहलेस नाच कुन जातिसँग सम्बन्धित छ ? ,दनुवार ,सतार,धिमाल  ,चेपाङ,a,
9,आफ्नो सम्पति अरूलाई नदिई थामी राख्ने जाति भन्नाले कुन जातिलाई चिनिन्छ ? ,धानुक,राजवंशी ,थामी ,धिताल,c,
9,थकाली जातिहरूले फागुपूर्णिमामा मनाउने चाड कुन हो ? ,फालो ,लाफेवा,सिरुवा,तोरनल्ह ,d,
9,भोटेसेलो कुन जातिसँग सम्बन्धित छ ? ,मगर,तामाङ,राई,लिम्बु,b,
9,मृत्यु संस्कारमा घेवा गर्ने चलन कुन जातिमा रहेको छ ? ,मगर,लिम्बु,तामाङ,शेर्पा,c,
9,डोल्पो जातिमा कस्तो विवाह प्रथा रहेको छ ? ,एकपति,बहुपति ,बहुपत्नी,अपहरण विवाह,b,
9,केटी माग्न जाँदा मंगलबार पारेर जाने जाति कुन हो ? ,धानुक,थामी ,राजवंशी ,चेपाङ,d,
9,विवाहमा छोरीलाई चिउरीको बोट दाइजो दिने चलन कुन जातिमा रहेको छ ? ,धिमाल  ,बाँतर,चेपाङ,माझी,c,
33,लिम्बु भाषाको प्रथम चलचित्र कुन हो ? ,शिलु,पाते,तखेवा ,नुमाफुङ,d,
9,च्याब्रुङ नाच र धान नाचलाई पर्वको रुपमा मनाउने जाति कुन हो ? ,लिम्बु ,गुरूङ,तामाङ,मगर,a,
9,लेप्चा जातिले आफूलाई के भन्न रूचाउँछन् ? ,जोङ्खा ,मुखिया,मास्टर,रोङ्ग ,d,
9,लेप्चा जातिले बच्चा जन्मिएको तेस्रो दिनमा सुत्केरी चोख्याउन के को प्रयोग गर्छन् ? ,दूध ,जाँड ,गहुँत,दही,b,
9,तेन्याचिरिस कुन जातिले मनाउने पर्व हो ? ,वनकरिया ,सौका ,सतार ,ल्होपा ,d,
9,श्रीमती हुँदाहुँदै अर्की श्रीमती ल्याएमा लोग्नेले घर छोड्नुपर्ने चलन कुन जातिमा रहेको छ ? ,ल्होपा ,ल्होमी ,चेपाङ,तामाङ,b,
9,छ महिना गाउँ र छ महिना जंगलमा बसोबास गर्ने जाति कुन हो ? ,राउटे,व्यासी,वनकरिया ,जिरेल,c,
9,आफूलाई व्यास ऋषिको वंशज मान्ने जाति कुन हो ? ,बराल,मगर,राम,व्यासी ,d,
9,शेर्पा जातिले गर्ने श्राद्धलाई के भनिन्छ ? ,तोरनाला,फोग्यु,तिथि,श्राद्ध,b,
9,व्यासी जातिलाई अर्को के नामले चिनिन्छ ? ,रोङ्ग,बोडो,सौका ,व्यास,c,
33,शेर्पा जातिको पहिलो चलचित्र कुन हो ? ,नुमाफुङ,राजमती,आप्पा,खाङ्गी ,d,
9,सतार जातिका महिलाहरूले लगाउने पोशाकलाई के भनिन्छ ? ,घलेक ,पालाहन्दा ,हाकु पटासी,जामा,b,
9,आफ्नो घर अगाडी बाबरी फूल रोप्ने चलन कुन जातिमा रहेको छ ? ,जिरेल,चेपाङ,सतार ,दनुवार,c,
9,सोहराय कुन जातिले मनाउने पर्व हो ? ,छन्त्याल  ,सतार ,सन्थाल ,झाँगड,b,
9,सुरेल जातिको न्वारन गर्ने कार्यलाई के भनिन्छ ? ,बासिने ,न्वारन,पासनी,नामाकरण,a,
9,शेर्पा जातिको कुल देवतालाई के भनिन्छ ? ,भिमसेन,जिङ,देउवागण,सहलेस,b,
9,दधिकाँधो पर्व कुन जातिसँग सम्बन्धित छ ? ,गन्धर्व ,सन्थाल ,राजवंशी ,सतार,c,
9,शेर्पा जातिको मुल थलो कुन जिल्लाई मानिन्छ ? ,संखुवासभा ,मुस्ताङ,हुम्ला,सोलुखुम्बु ,d,
9,दधिकाँधो पर्व कहिले मनाइन्छ ? ,रामनवमीमा,शिवरात्रीको अघिल्लो दिन,कृष्ण जन्माष्टमीको भोलिपल्ट,फागु पूर्णिमामा,c,
9,शिरूवा पर्व कुन जातिसँग सम्बन्धित छ ? ,थारू,राजवंशी ,दनुवार,सतार,b,
9,चैतेनी कुन जातिले मनाउने पर्व हो ? ,राजवंशी ,गन्धर्व ,दनुवार,चेपाङ,b,
9,राजवंशी जातिको मुख्य पर्व कुन हो ? ,माघी,ल्होसार,शिरुवा ,चैतेनी,c,
9,गुरुङ महिलाले पिठ्यूँमा गादो भिर्ने कपडालाई के भनिन्छ ? ,घलेक वा पेटाङे ,बुर्का,खास्टो,मजेत्रो,a,
9,मौरी बाजा कुन जातिको परम्परागत बाजा हो ?,थकाली ,सन्थाल ,गन्धर्व ,छन्त्याल  ,d,
9,बाहा पर्व कुन जातिसँग सम्बन्धित छ ? ,धिमाल,चेपाङ,सतार ,दनुवार,c,
9,भारतमा सतार जातिलाई के भनिन्छ ? ,सत्याल,सतार ,सन्थाल ,सुनुवार,c,
9,डोल्पो जातिलाई स्थानीय भाषामा के भनिन्छ ? ,डोल्पाली,धोल्पोवा ,डोल्मा,ल्होमी,b,
9,मेचे जातिलाई अर्को के नामले चिनिन्छ ? ,सुरेल ,जिरेल,रोङ्ग,बोडो,d,
33,चिन्नो जान्नो कुन भाषाको पत्रिका हो ?  ,तामाङ,नेपाली,चेपाङ,मैथली,c,
9,छन्त्याल जातिको मुख्य चाड कुन हो ? ,लाफेवा,लागाँ,बाहा,ल्होसार,b,
9,थकाली जातिहरूले ल्हाफेवा चाड कति वर्षमा मनाउने गर्दछन् ? ,५/५ वर्षमा ,२/२ वर्षमा ,१०/१०वर्षमा,१२/१२ वर्षमा ,d,
4,नेवारहरूलाई ६४ जातमा विभाजन कसले गरेका थिए ? ,जयस्थिति मल्ल,प्रताप मल्ल,मानदेव,अंशुबर्मा,a,
9,कुन जातिमा ढिकुर प्रथा कायम रहेको छ ?,पहरी ,थकाली ,धिमाल,चेपाङ,b,
9,थारु जातिको गाउँको प्रमुखलाई के भनिन्छ ?  ,मुखिया,जिवा,सरपन्च,भलमन्सा,d,
9,थारु जातिको कुल देवतालाई के भनिन्छ ?,भिमसेन,वायु,पुरेत,भुसाल ,d,
9,रणवाघ भन्नाले कुन बाजालाई चिनिन्छ ? ,धिमे,सहनाई,सारङ्गी,विनायो,a,
9,महिलाको लासलाई तेल लगाएर गाड्ने चलन कुन जातिमा रहेको छ ?  ,बाँतर,धिमाल,सतार,थकाली ,b,
33,नेवारी भाषाको पहिलो चलचित्र कुन हो ? ,राजमती,महानर्क,सिलु ,नुमाफुङ,c,
33,साहित्य लेखनमा नेपाली पछिको दोस्रो भाषा कुन हो ? ,नेवारी ,तामाङ,मैथली,थारू,a,
