category_id,post_name,option A,option B,option C,option D,correct option,explanation
4,नेपालको कुन जिल्लामा सबैभन्दा बढी विमानस्थल छ ? ,काठमाडौँ ,सोलुखुम्बु,धनगढी, पोखरा ,b,
32,स्वस्थ वातावरणको लागि कति प्रतिशत जंगलको आवश्यकता पर्छ ? ,३९ प्रतिशत,४० प्रतिशत,४३ प्रतिशत,४५ प्रतिशत ,c,
32,एउटा रूखले कति अक्सिजन उत्पादन गर्न सक्छ ? ,२७ के.जी ,३० के.जी,४० के.जी,४५ के.जी ,a,
32,पृथ्वीले एक सेन्टीमिटर माटो बनाउन कति समय लिन्छ ?,१००० वर्ष,५०० वर्ष ,४०० वर्ष,२०० वर्ष ,c,
29,नेपालको अन्तिम राणा प्रधानमन्त्री को हुन् ? ,धिर शमशेर,वीर शमशेर,मोहन शमशेर,पद्म शमशेर ,c,
28,दोश्रो विश्वयुद्धको समयमा नेपालको प्रधानमन्त्री को थिए ?,देव शमशेर,वीर शमशेर,धीर शमशेर,जुद्ध शमशेर ,d,
16,नेपाल समुद्रदेखि कति टाढा रहेको छ  ? ,२२२७ कि.मी,१११७ कि.मी, ११२७ कि.मी,१११५ कि.मी ,c,
16,लिखु नदीको अर्को नाम के हो ? ,अरुण,बरुण ,महाप्रभा,शीतप्रभा ,b,
29,अरनिकोको वास्तविक नाम के हो ? ,सुबाहु,बलबाहु,भिमसेन,सुमन्त्र,b,
29,कोतपर्वमा सबभन्दा पहिला मारिने व्यक्ति को थिए ? ,अभिमान सिंह बस्नेत,माथवरसिंह थापा,सुब्बा कृष्णलाल अधिकारी, विरेन्द्रसिंह बस्नेत ,a,
20,सेतो हात्तीको देश भनेर कुन देशलाई चिनिन्छ ? ,फिलिपिन्स,नेदरल्याण्ड,थाइल्याण्ड,सिंगापुर ,c,
28,अमेरिकाको ४४ औं राष्ट्रपति को हुन् ? ,जर्ज डब्ल्यू बुस ,अब्राहम लिङ्कन,बाराक ओबामा ,विल क्लिन्टन,c,
20,गौतम बुद्धको सबभन्दा ठूलो मूर्ति कुन देशमा छ ? ,बर्मा,नेपाल,श्रीलंका ,अफगानिस्तान,d,
20,विश्वमा अंग्रेजी पछाडी सबभन्दा बढी बोलिने भाषा कुन हो ?,नेपाली ,चाइनिज,हिन्दी,उर्दू ,b,
1,विश्वका कति प्रतिशत मानिस पहाडी क्षेत्रमा बसोबास गर्छन् ? ,१२ प्रतिशत,१८ प्रतिशत,२२ प्रतिशत,२३ प्रतिशत,a,
20,कुन वैज्ञानिकले आफ्नो नाम समेत बिर्सन्थे ? ,थोमस अल्वा एडिसन,सर आइज्याक न्यूटन ,आर्किमिडिज ,अल्बर्ट आइन्स्टाइन,a,
25,हाम्रो शरीरमा कति प्रकारका मांसपेशीहरू हुन्छन् ? ,५,४,३,२,c,
32,हावामा कति प्रतिशत अक्सिजन पाइन्छ ?,१७ प्रतिशत,३० प्रतिशत ,२७ प्रतिशत ,२१ प्रतिशत,d,
9,फलफूलको राजा मानिने आँपमा कुन भिटामिन पाइन्छ ? ,ए ,बी,सी,के ,a,
29,नेपालबाट चीन जाने पहिलो व्यक्ति को हुन् ?,अरनिको ,बुद्धभद्र ,श्री ५ महेन्द्र,जंगबहादुर राणा ,b,
29,पृथ्वीनारायण शाहको मावली कहाँ थियो   ?,मकवानपुर,पाल्पा ,काठमाडौँ,भक्तपुर,b,
29,नेपालमा शाशन गर्ने पहिलो वंश कुन हो ?,महिषपाल वंश,किराँत वंश,गोपाल वंश,शाह वंश,c,
29,नेपालको राजदरबार हनुमान ढोकाबाट नारायण हिटी कुन राजाको पालामा सारिएको थियो ?,प्रताप मल्ल ,पृथ्वीनारायण शाह ,प्रतापसिंह साह,पृथ्वी विरविक्रम,d,
29,गोपाल राज वंशावली कसको पालामा तयार पारिएको हो ? ,जयस्थिति मल्ल ,यक्ष मल्ल,प्रताप मल्ल ,वरसिंह,a,
29,किराँती राजा यलम्बरलाई अर्को कुन नामले चिनिन्छ ? ,गस्ती,स्थुँको,भुवनसिंह,यलुङ,d,
29,राजा विरेन्द्रले नेपाललाई शान्ति क्षेत्र घोषणा गरियोस् भनि विश्वसामु कहिले प्रस्ताव राखेका थिए ? ,२०३१ माघ १३ ,२०३१ फागुन १३ ,२०३२ फागुन १३,२०३१ भदौ १३,b,
29,कार्तिक नाचलाई एक महिनाको बनाउने राजा को हुन् ? ,योग नरेन्द्र मल्ल ,जय प्रकाश मल्ल ,प्रतापसिंह साह ,अंशुबर्मा,a,
29,कैलाशकुट भवनको महिमा कहाँको शीलालेखमा उल्लेख छ ? ,अशोक शिलालेख,स्वयम्भू शिलालेख,साँगाको शीलालेखमा ,चाँगुनारायण शिलालेख,c,
29,अरनिको चीन जाँदा कति वर्षका थिए ? ,१५,२५,२७,१७,d,
29,लिच्छवी कालमा शिक्षाको माध्यम भाषा के थियो ? ,नेपाली भाषा ,संस्कृत र पाली भाषा,भोजपुरी,मैथिली,b,
29,शिलालेखमा स्वस्ती नेपालेभ्य लेख्ने राजा को हुन् ? ,यलम्बर,बसन्तदेव,प्रताप मल्ल,श्री निवास मल्ल ,b,
29,मानाङ्क मुद्रा कुन धातुबाट बनाइएको थियो ? ,सुन,फलाम , चाँदी,तामा ,d,
29,मानदेवले प्रचलनमा ल्याएको मुद्रालाई के भनिन्छ । ,जावा ,पण ,मानाङ्क ,मोहर,c,
20,१पुराणमा कति पण हुन्थ्यो ? ,१०,१८,१६ पण ,१२,c,
29,गुणकामदेवले कान्तिपुर शहरको स्थापना गर्दा कति घरहरू बनाएका थिए ? ,१० हजार,१८ सय,१२ हजार ,१८ हजार ,d,
29,पान्चाली प्रथाको शुरुवात गर्ने राजा को हुन् ? ,अंशुवर्मा ,अरिदेव,प्रताप मल्ल,जगज्योति मल्ल ,a,
28,विश्वको सबैभन्दा सानो मुद्रा जावा निस्कासन गर्ने राजा को हुन् ? ,गुणकामदेव ,जयप्रकाश मल्ल ,जयदेव,रणबहादुर शाह ,b,
33,मानव न्यायशास्त्र कसको कृति हो ? ,योग नरेन्द्र मल्ल ,महिन्द्र मल्ल,जयस्थिति मल्ल ,प्रताप मल्ल ,c,
29,कवि चुणामणि सम्राट भनेर कुन राजालाई चिनिन्छ ? ,जयस्थिति मल्ल ,भूपतिन्द्र मल्ल ,रणजित मल्ल, सिद्धिनरसिंह मल्ल,b,
29,जनताको राय विना कुनै पनि काम नगर्ने राजा को हुन् ? ,रणबहादुर शाह,भूपतिन्द्र मल्ल , रणजित ,जयस्थिति मल्ल ,c,
29,राजा अंशुवर्माकी बहिनीको नाम के थियो ? ,भृकुटी ,भोगदेवी ,तारादेवी,सुनन्दा,b,
33,अंशुवर्माले चन्द्र व्याकरण कसलाई लेख्न लगाएका थिए ? ,चन्द्र बर्मा गोमी ,लक्ष्मी प्रसाद देवकोटा , प्रेम निधि पन्त , मोतीराम भट्ट,a,
29,बहुलाकाजी भनेर चिनिने राजा को हुन् ? ,जयस्थिति मल्ल ,लक्ष्मी नरसिंह मल्ल,रणबहादुर शाह ,प्रताप मल्ल,b,
10,जयतु संस्कृतम आन्दोलन कसको पालामा भएको थियो ? ,धीर शमशेर ,जुद्धशमशेर,पद्मशमशेर,वीर शमशेर ,c,
4,गोरखापत्रको प्रकाशन कहिले र भएको थियो ? ,वि.सं १९५८ बैशाख २४ ,वि.सं १९५८ असार२४ ,वि.सं १९५२ बैशाख २४ ,वि.सं १९५५ बैशाख २४ ,a,
29,नेपालको इतिहासमा सबैभन्दा छोटो कार्यकाल भएका राणा प्रधानमन्त्री को थिए ? ,जंगबहादुर राणा,मोहनशमशेर,धीर शमशेर ,देव शमशेर,d,
29,भाषा पाठशालाको स्थापना गर्ने राणा प्रधानमन्त्री को थिए ?,देवशमशेर ,मोहनशमशेर ,जंग बहादुर राणा ,पद्मशमशेर ,a,
4,चिठीमा टिकट टाँस्ने चलन कसले चलाएका हुन् ?,श्री ५ त्रिभुवन,जुद्ध शमशेर,लक्ष्मी प्रसाद देवकोटा,धीर शमशेर,b,
29,फिस्टे महाराज भन्नाले कसलाई चिनिन्छ ?,मोहनशमशेर ,श्री ५ सुरेन्द्र,अंशुबर्मा,चन्द्र शमशेर ,d,
29,शरणको मरण गर्नु हुँदैन भन्ने राजा को हुन् ? ,प्रताप मल्ल,रणजीत मल्ल ,अंशुबर्मा,लक्ष्मी नरसिंह मल्ल,b,
29,पशुपति नाथमा भट्ट पुजारी राख्ने चलन कसले चलाएका हुन् ?,यक्ष मल्ल ,प्रताप मल्ल,जयस्थिति मल्ल ,सिद्धिनरसिंह मल्ल ,a,
29,प्रजा मर्दा छाक छोड्ने राजा को हुन् ? ,महेन्द्र मल्ल ,भिम मल्ल,श्री ५ महेन्द्र,अंशुबर्मा,a,
29,डोला प्रथाको शुरुवात गर्ने राजा को हुन् ? ,सुपुष्प ,गुणकामदेव ,प्रताप मल्ल,रणजीत मल्ल ,c,
29,लिच्छवी कालका आदि पुरुष कसलाई भनिन्छ ? ,अंशुबर्मा,मानदेव,जयदेव ,सुपुष्प ,d,
29,कान्तिपुर शहरको स्थापना कसले गरेका हुन् ?,जयदेव ,गुणकामदेव ,प्रताप मल्ल,मोहनशमशेर ,b,
29,अरनिकोले प्रचलनमा ल्याएको प्यागोडा शैलीलाई के भनिन्छ ?,चाइनिज प्यागोडा ,पूर्वी एशियाली प्यागोडा,पाइतास्ते ,मुगल प्यागोडा ,c,
29,विभाजन पछि पाटनका प्रथम राजा को थिए ?,जयस्थिति मल्ल ,सिद्धिनरसिंह मल्ल ,शिवसिंह मल्ल,रण मल्ल ,d,
4,काष्टमण्डप कति क्षेत्रफलमा फैलिएको छ ?,२५ वर्ग कि.मी ,२० वर्ग कि.मी ,१५ वर्ग कि.मी ,१० वर्ग कि.मी ,b,
29,प्रथम किराँति राजा यलम्बरले कसलाई पराजित गरी शाशन सत्ता हातमा लिएका थिए? ,जयदेव प्रथम ,सुपुष्प ,भूवनसिंह ,प्रचण्डदेव,c,
29,नेपाल शब्दको पहिलो उल्लेख कहाँ भएको थियो ? ,मनुस्मृती ,चाणक्य नीति ,महाभारत,अर्थव परिशिस्टमा ,d,
29,योग्य बाबुका अयोग्य सन्तानका रुपमा कसलाई चिनिन्छ ? ,रणबहादुर शाह ,प्रताप मल्ल ,प्रतापसिंह शाह ,श्री ५ सुरेन्द्र,c,
29,बहादुर शाहको अर्को नाम के थियो ? ,कर्म बहादुर ,फत्ते बहादुर ,रण बहादुर ,बल बहादुर ,b,
29,सुन्धाराको निर्माण कसले गरेका थिए ? ,भिमसेन थापा ,जयदेव ,श्री ५ सुरेन्द्र,श्री ५ महेन्द्र,,
29,महेन्द्र राजमार्गको शिलन्यास कहिले कसले गरेका थिए ? ,"बिरेन्द्र,१९ वैशाख २०२१","श्री ५ महेन्द्र वैशाख १९, २०२०","श्री ५ महेन्द्र वैशाख २०, २०२०","श्री ५ महेन्द्र जेठ १९, २०२०",c,
29,पशुपतिका प्रथम भट्ट पुजारी को थिए  ? ,स्वामि शेखरानन्द ,महाबलेश्वर भट्ट,भूपतिन्द्र भट्ट,श्री निवास भट्ट,a,
29,नेपालमा चलचित्र बनाउनका लागि उत्प्रेरणा दिने राजा को हुन् ? ,प्रतापसिंह शाह ,रणबहादुर शाह ,श्री ५ बिरेन्द्र ,राजा महेन्द्र ,d,
4,चश्मा लगाउने पहिलो नेपाली को हुन् ? ,राजा महेन्द्र ,सुरेन्द्र विक्रम शाह ,रणबहादुर शाह ,जंग बहादुर राणा ,b,
29,अरिदेव मल्लका छोरा को थिए ? ,जयदेव मल्ल   ,उदयदेव मल्ल,रणजित मल्ल,अभय मल्ल ,d,
29,श्री ५ राजेन्द्रलाई राजगद्दीबाट पदच्युत गरी बन्दी गराउने को हुन् ? ,मोहन शमशेर,चन्द्र शमशेर,जंग बहादुर ,देव शमशेर,c,
29,उपत्यकाको राज्य विभाजन गरी आफ्ना छोराहरूलाई बाँड्ने राजा को हुन् ? ,अभय मल्ल ,यक्ष मल्ल ,रणजित मल्ल,भूपतिन्द्र मल्ल,b,
29,धरहराको निर्माण कहिले भएको थियो ? ,वि.सं १८८०,वि.सं १८९०,वि.सं १९८३,वि.सं १९८२ ,d,
29,कुन शाह वंशिय राजाको पालामा नेपालको सिमाना तेब्बर भएको थियो ? ,प्रतापसिंह शाह ,पृथ्वी नारायण शाह ,बहादुर शाह ,श्री ५ महेन्द्र,c,
28,मिश्रको सभ्यता कुन नदीको किनारमा विकसित भएको हो ? ,जोर्डन नदी ,नाइल नदी ,मिसिसिपी नदी ,अमेजन नदी ,b,
28,प्राग ऐतिहासिक युगलाई अर्को कुन नामले पनि चिनिन्छ ? ,मध्य युग ,प्राचीन युग ,हिम युग ,सत्य युग,c,
28,युरोपमा प्राचीन युगको अन्त्य कहिले भएको मानिन्छ ? ,सन् ६४६,सन् ४४६,सन् ५७६,सन् ४७६,d,
28,भारतीय महाद्धिपमा विकसित भएको वैदिक सभ्यतालाई के भनिन्छ ? ,आर्य सभ्यता ,रोमको सभ्यतामा ,मंगोलियन सभ्यता ,सिन्धुघाँटी सभ्यता ,a,
28,प्रस्तर कलाको सुरुवात कहाँबाट भएको हो ? ,रोम,मिश्र ,युनान,नेपाल,b,
28,कुन सभ्यतामा तामा पत्ता लगाइएको थियो ? ,सिन्धुघाँटी ,रोमको सभ्यतामा ,मेसोपोटामियाको सभ्यता ,सिन्धुघाँटी सभ्यता ,a,
28,सर्वपप्रथम नाटक लेख्ने र रंगमन्चन गर्ने कार्यको थालनी कहाँबाट भएको हो ? ,अमेरिका ,इजरायल,युनान,रसिया,c,
28,पत्थरको मुद्राको विकास कुन सभ्यतामा भएको थियो ? ,मेसोपोटामियाको सभ्यता ,रोमको सभ्यतामा ,आर्य सभ्यता ,सिन्धुघाँटी सभ्यता ,a,
28,सबभन्दा पहिला सिमेन्टको प्रयोग कुन सभ्यतामा भएको थियो ? ,मंगोलियन सभ्यता ,सिन्धुघाँटी सभ्यता ,रोमको सभ्यतामा ,मेसोपोटामियाको सभ्यता ,c,
28,मध्य युगमा इसाई र इस्लाम धर्मावलम्वीहरूको बीच भएको युद्धलाई कुन नामले चिनिन्छ ? ,धार्मिक युद्ध ,स्वतन्त्रताको युद्ध,सामाजिक युद्ध,कुसेड ,d,
28,चिनियाँ सभ्यताको विकास कहिले भएको मानिन्छ ? ,इ.पू १४००,ई.पू २८५२ ,इ.पू २५००,इ.पू २६२०,b,
28,इस्लाम धर्मको उदयलाई कुन युगको देन मानिन्छ ? ,प्राचिन युग,मध्य युग ,प्राग ऐतिहासिक,आधुनिक काल,b,
28,मध्य युगलाई अर्को के नामले चिनिन्छ ? ,सामन्ती युग ,प्राचिन युग,प्राग ऐतिहासिक,आदिम,a,
28,यूनानी सभ्यतामा राजालाई के भनिन्थ्यो ? ,प्राग ऐतिहासिक,जार,किङ्ग,पोलिस ,d,
28,नगर योजनाको विकासको सुरुवात कुन सभ्यताको विशेषता मानिन्छ ? ,रोमको सभ्यतामा ,मेसोपोटामियाको सभ्यता ,सिन्धुघाँटीको सभ्यता,चिनियाँ सभ्यता ,c,
28,सुमेरियनहरूको कानुन संग्रह कुन देवताको नाममा गरिएको थियो ? ,जिसस,जियस ,अल्लाह,दिनाभद्री ,b,
28,मध्यकालमा देशको सम्पूर्ण जमिनको मालिक को हुने व्यवस्था थियो ? ,महाजन,व्यापारी ,जिम्वाल,राजा ,d,
28,मिश्रको इतिहासमा कसको युगलाई स्वर्ण युग भनिन्थ्यो ? ,अमनहोटेप चतुर्थ ,टरिन क्यानन,फारोह,फारुक,a,
28,यूनानी सभ्यतामा प्रमुख बाली के थियो ? ,गहुँ ,मकै,भटमास,धान,a,
25,सूर्य एवम् ग्रहहरू पृथ्वीको वरिपरि घुम्छन् भन्ने विचारको खण्डन गरे वापत जिउँदै जलाइएका वैज्ञानिक को हुन् ? ,ग्यालिलियो ग्यालिलि,निकोलस कोपर्निकस,निल आर्मस्ट्रङ,गिआर्डिनो ब्रुनो ,d,
28,कुन चाहिँ सभ्यतामा सार्वजनिक सेवामा सर्वप्रथम प्रतियोगितात्मक प्रणाली अपनाइएको थियो ? ,आर्य सभ्यता ,चिनियाँ सभ्यता ,रुसी सभ्यता,अमेरिकन सभ्यता,b,
28,मानव सभ्यता सम्बन्धी इतिहासमा सबैभन्दा बढी विकसित र महत्वपूर्ण सभ्यता कुनलाई मानिन्छ ? ,रोमको सभ्यतामा ,मेसोपोटामियाको सभ्यता ,सिन्धुघाँटीको सभ्यता,ग्रीसको प्राचीन सभ्यता ,d,
28,डेटोटिक लिपिको विकास कुन सभ्यतामा भएको थियो ? ,ग्रीसको प्राचीन सभ्यता ,मिश्रको सभ्यता ,रोमको सभ्यतामा ,चिनियाँ सभ्यता ,b,
29,पृथ्वीनारायण शाहको पहिलो विवाह कोसँग भएको थियो ? ,नरेन्द्र लक्ष्मी ,बिजय लक्ष्मी,इन्द्रकुमारी ,राजेन्द्रलक्ष्मी,b,
29,नेपाल प्रवेश गर्नु भन्दा पहिला अहिरवंशीहरूको मुल थलो कहाँ थियो ? ,"मथुरा वृन्दावन, भारत ","अयोध्या, भारत","सिक्किम, भारत","भोपाल, भारत",a,
9,पैसा छुँदा पाप लाग्छ भन्ने विश्वास कुन जातीमा रहेको छ ? ,धिमाल ,सन्थाल ,राउटे ,मेचे,c,
